{"bars":[{"close_bp":1200,"high_bp":1200,"low_bp":1200,"n_trades":0,"open_bp":1200,"open_interest":null,"t_ms":1690329600000,"volume_milli":0,"vwap_bp":1200,"yes_ask_bp":null,"yes_bid_bp":null},{"close_bp":1200,"high_bp":1200,"low_bp":1200,"n_trades":0,"open_bp":1200,"open_interest":null,"t_ms":1690416000000,"volume_milli":0,"vwap_bp":1200,"yes_ask_bp":null,"yes_bid_bp":null},{"close_bp":3200,"high_bp":3200,"low_bp":1200,"n_trades":0,"open_bp":1200,"open_interest":null,"t_ms":1690502400000,"volume_milli":0,"vwap_bp":3200,"yes_ask_bp":null,"yes_bid_bp":null},{"close_bp":3200,"high_bp":3200,"low_bp":3200,"n_trades":0,"open_bp":3200,"open_interest":null,"t_ms":1690588800000,"volume_milli":0,"vwap_bp":3200,"yes_ask_bp":null,"yes_bid_bp":null},{"close_bp":4800,"high_bp":4800,"low_bp":3200,"n_trades":0,"open_bp":3200,"open_interest":null,"t_ms":1690675200000,"volume_milli":0,"vwap_bp":4800,"yes_ask_bp":null,"yes_bid_bp":null},{"close_bp":4800,"high_bp":4800,"low_bp":4800,"n_trades":0,"open_bp":4800,"open_interest":null,"t_ms":1690761600000,"volume_milli":0,"vwap_bp":4800,"yes_ask_bp":null,"yes_bid_bp":null},{"close_bp":5200,"high_bp":5200,"low_bp":4800,"n_trades":0,"open_bp":4800,"open_interest":null,"t_ms":1690848000000,"volume_milli":0,"vwap_bp":5200,"yes_ask_bp":null,"yes_bid_bp":null},{"close_bp":5200,"high_bp":5200,"low_bp":5200,"n_trades":0,"open_bp":5200,"open_interest":null,"t_ms":1690934400000,"volume_milli":0,"vwap_bp":5200,"yes_ask_bp":null,"yes_bid_bp":null},{"close_bp":4000,"high_bp":5200,"low_bp":4000,"n_trades":0,"open_bp":5200,"open_interest":null,"t_ms":1691020800000,"volume_milli":0,"vwap_bp":4000,"yes_ask_bp":null,"yes_bid_bp":null},{"close_bp":4000,"high_bp":4000,"low_bp":4000,"n_trades":0,"open_bp":4000,"open_interest":null,"t_ms":1691107200000,"volume_milli":0,"vwap_bp":4000,"yes_ask_bp":null,"yes_bid_bp":null},{"close_bp":4000,"high_bp":4000,"low_bp":4000,"n_trades":0,"open_bp":4000,"open_interest":null,"t_ms":1691193600000,"volume_milli":0,"vwap_bp":4000,"yes_ask_bp":null,"yes_bid_bp":null},{"close_bp":2200,"high_bp":4000,"low_bp":2200,"n_trades":0,"open_bp":4000,"open_interest":null,"t_ms":1691280000000,"volume_milli":0,"vwap_bp":2200,"yes_ask_bp":null,"yes_bid_bp":null},{"close_bp":2200,"high_bp":2200,"low_bp":2200,"n_trades":0,"open_bp":2200,"open_interest":null,"t_ms":1691366400000,"volume_milli":0,"vwap_bp":2200,"yes_ask_bp":null,"yes_bid_bp":null},{"close_bp":2200,"high_bp":2200,"low_bp":2200,"n_trades":0,"open_bp":2200,"open_interest":null,"t_ms":1691452800000,"volume_milli":0,"vwap_bp":2200,"yes_ask_bp":null,"yes_bid_bp":null},{"close_bp":2200,"high_bp":2200,"low_bp":2200,"n_trades":0,"open_bp":2200,"open_interest":null,"t_ms":1691539200000,"volume_milli":0,"vwap_bp":2200,"yes_ask_bp":null,"yes_bid_bp":null},{"close_bp":900,"high_bp":2200,"low_bp":900,"n_trades":0,"open_bp":2200,"open_interest":null,"t_ms":1691625600000,"volume_milli":0,"vwap_bp":900,"yes_ask_bp":null,"yes_bid_bp":null},{"close_bp":900,"high_bp":900,"low_bp":900,"n_trades":0,"open_bp":900,"open_interest":null,"t_ms":1691712000000,"volume_milli":0,"vwap_bp":900,"yes_ask_bp":null,"yes_bid_bp":null},{"close_bp":900,"high_bp":900,"low_bp":900,"n_trades":0,"open_bp":900,"open_interest":null,"t_ms":1691798400000,"volume_milli":0,"vwap_bp":900,"yes_ask_bp":null,"yes_bid_bp":null},{"close_bp":900,"high_bp":900,"low_bp":900,"n_trades":0,"open_bp":900,"open_interest":null,"t_ms":1691884800000,"volume_milli":0,"vwap_bp":900,"yes_ask_bp":null,"yes_bid_bp":null},{"close_bp":900,"high_bp":900,"low_bp":900,"n_trades":0,"open_bp":900,"open_interest":null,"t_ms":1691971200000,"volume_milli":0,"vwap_bp":900,"yes_ask_bp":null,"yes_bid_bp":null},{"close_bp":900,"high_bp":900,"low_bp":900,"n_trades":0,"open_bp":900,"open_interest":null,"t_ms":1692057600000,"volume_milli":0,"vwap_bp":900,"yes_ask_bp":null,"yes_bid_bp":null},{"close_bp":900,"high_bp":900,"low_bp":900,"n_trades":0,"open_bp":900,"open_interest":null,"t_ms":1692144000000,"volume_milli":0,"vwap_bp":900,"yes_ask_bp":null,"yes_bid_bp":null},{"close_bp":900,"high_bp":900,"low_bp":900,"n_trades":0,"open_bp":900,"open_interest":null,"t_ms":1692230400000,"volume_milli":0,"vwap_bp":900,"yes_ask_bp":null,"yes_bid_bp":null},{"close_bp":900,"high_bp":900,"low_bp":900,"n_trades":0,"open_bp":900,"open_interest":null,"t_ms":1692316800000,"volume_milli":0,"vwap_bp":900,"yes_ask_bp":null,"yes_bid_bp":null},{"close_bp":900,"high_bp":900,"low_bp":900,"n_trades":0,"open_bp":900,"open_interest":null,"t_ms":1692403200000,"volume_milli":0,"vwap_bp":900,"yes_ask_bp":null,"yes_bid_bp":null},{"close_bp":300,"high_bp":900,"low_bp":300,"n_trades":0,"open_bp":900,"open_interest":null,"t_ms":1692489600000,"volume_milli":0,"vwap_bp":300,"yes_ask_bp":null,"yes_bid_bp":null},{"close_bp":300,"high_bp":300,"low_bp":300,"n_trades":0,"open_bp":300,"open_interest":null,"t_ms":1692576000000,"volume_milli":0,"vwap_bp":300,"yes_ask_bp":null,"yes_bid_bp":null},{"close_bp":300,"high_bp":300,"low_bp":300,"n_trades":0,"open_bp":300,"open_interest":null,"t_ms":1692662400000,"volume_milli":0,"vwap_bp":300,"yes_ask_bp":null,"yes_bid_bp":null},{"close_bp":300,"high_bp":300,"low_bp":300,"n_trades":0,"open_bp":300,"open_interest":null,"t_ms":1692748800000,"volume_milli":0,"vwap_bp":300,"yes_ask_bp":null,"yes_bid_bp":null},{"close_bp":300,"high_bp":300,"low_bp":300,"n_trades":0,"open_bp":300,"open_interest":null,"t_ms":1692835200000,"volume_milli":0,"vwap_bp":300,"yes_ask_bp":null,"yes_bid_bp":null},{"close_bp":300,"high_bp":300,"low_bp":300,"n_trades":0,"open_bp":300,"open_interest":null,"t_ms":1692921600000,"volume_milli":0,"vwap_bp":300,"yes_ask_bp":null,"yes_bid_bp":null},{"close_bp":300,"high_bp":300,"low_bp":300,"n_trades":0,"open_bp":300,"open_interest":null,"t_ms":1693008000000,"volume_milli":0,"vwap_bp":300,"yes_ask_bp":null,"yes_bid_bp":null},{"close_bp":300,"high_bp":300,"low_bp":300,"n_trades":0,"open_bp":300,"open_interest":null,"t_ms":1693094400000,"volume_milli":0,"vwap_bp":300,"yes_ask_bp":null,"yes_bid_bp":null},{"close_bp":300,"high_bp":300,"low_bp":300,"n_trades":0,"open_bp":300,"open_interest":null,"t_ms":1693180800000,"volume_milli":0,"vwap_bp":300,"yes_ask_bp":null,"yes_bid_bp":null},{"close_bp":300,"high_bp":300,"low_bp":300,"n_trades":0,"open_bp":300,"open_interest":null,"t_ms":1693267200000,"volume_milli":0,"vwap_bp":300,"yes_ask_bp":null,"yes_bid_bp":null},{"close_bp":300,"high_bp":300,"low_bp":300,"n_trades":0,"open_bp":300,"open_interest":null,"t_ms":1693353600000,"volume_milli":0,"vwap_bp":300,"yes_ask_bp":null,"yes_bid_bp":null},{"close_bp":300,"high_bp":300,"low_bp":300,"n_trades":0,"open_bp":300,"open_interest":null,"t_ms":1693440000000,"volume_milli":0,"vwap_bp":300,"yes_ask_bp":null,"yes_bid_bp":null}],"category":"science","close_at_ms":1693526399000,"created_at_ms":1690329600000,"currency":"usd","description":"","event_key":null,"fee_schedule_id":"demo-zero","final_price_bp":300,"first_price_bp":1200,"hardness_tags":[],"id":"demo-lk99-superconductor-2023","interval_min":1440,"notes":"A viral July 2023 hype spike that replications quickly demolished. A textbook bubble.","provider":"demo","provider_id":"lk99-superconductor-2023","quality":{"life_days":36,"n_trades":0,"traded_bars":0,"unique_bettors":null,"volume_milli_total":0},"question":"Will LK-99 be confirmed as a room-temperature ambient-pressure superconductor?","resolution":0,"resolution_source":"v1 demo pack","resolved_at_ms":1693526399000,"schema_version":"market.v2","source":"reconstructed","tags":[],"trades":[],"url":"","wiki_subjects":["LK-99","Room-temperature superconductor"]}
