{"bars":[{"close_bp":1800,"high_bp":1800,"low_bp":1800,"n_trades":0,"open_bp":1800,"open_interest":null,"t_ms":1668816000000,"volume_milli":0,"vwap_bp":1800,"yes_ask_bp":null,"yes_bid_bp":null},{"close_bp":1800,"high_bp":1800,"low_bp":1800,"n_trades":0,"open_bp":1800,"open_interest":null,"t_ms":1668902400000,"volume_milli":0,"vwap_bp":1800,"yes_ask_bp":null,"yes_bid_bp":null},{"close_bp":1800,"high_bp":1800,"low_bp":1800,"n_trades":0,"open_bp":1800,"open_interest":null,"t_ms":1668988800000,"volume_milli":0,"vwap_bp":1800,"yes_ask_bp":null,"yes_bid_bp":null},{"close_bp":900,"high_bp":1800,"low_bp":900,"n_trades":0,"open_bp":1800,"open_interest":null,"t_ms":1669075200000,"volume_milli":0,"vwap_bp":900,"yes_ask_bp":null,"yes_bid_bp":null},{"close_bp":900,"high_bp":900,"low_bp":900,"n_trades":0,"open_bp":900,"open_interest":null,"t_ms":1669161600000,"volume_milli":0,"vwap_bp":900,"yes_ask_bp":null,"yes_bid_bp":null},{"close_bp":900,"high_bp":900,"low_bp":900,"n_trades":0,"open_bp":900,"open_interest":null,"t_ms":1669248000000,"volume_milli":0,"vwap_bp":900,"yes_ask_bp":null,"yes_bid_bp":null},{"close_bp":900,"high_bp":900,"low_bp":900,"n_trades":0,"open_bp":900,"open_interest":null,"t_ms":1669334400000,"volume_milli":0,"vwap_bp":900,"yes_ask_bp":null,"yes_bid_bp":null},{"close_bp":900,"high_bp":900,"low_bp":900,"n_trades":0,"open_bp":900,"open_interest":null,"t_ms":1669420800000,"volume_milli":0,"vwap_bp":900,"yes_ask_bp":null,"yes_bid_bp":null},{"close_bp":1500,"high_bp":1500,"low_bp":900,"n_trades":0,"open_bp":900,"open_interest":null,"t_ms":1669507200000,"volume_milli":0,"vwap_bp":1500,"yes_ask_bp":null,"yes_bid_bp":null},{"close_bp":1500,"high_bp":1500,"low_bp":1500,"n_trades":0,"open_bp":1500,"open_interest":null,"t_ms":1669593600000,"volume_milli":0,"vwap_bp":1500,"yes_ask_bp":null,"yes_bid_bp":null},{"close_bp":1500,"high_bp":1500,"low_bp":1500,"n_trades":0,"open_bp":1500,"open_interest":null,"t_ms":1669680000000,"volume_milli":0,"vwap_bp":1500,"yes_ask_bp":null,"yes_bid_bp":null},{"close_bp":1500,"high_bp":1500,"low_bp":1500,"n_trades":0,"open_bp":1500,"open_interest":null,"t_ms":1669766400000,"volume_milli":0,"vwap_bp":1500,"yes_ask_bp":null,"yes_bid_bp":null},{"close_bp":1500,"high_bp":1500,"low_bp":1500,"n_trades":0,"open_bp":1500,"open_interest":null,"t_ms":1669852800000,"volume_milli":0,"vwap_bp":1500,"yes_ask_bp":null,"yes_bid_bp":null},{"close_bp":1500,"high_bp":1500,"low_bp":1500,"n_trades":0,"open_bp":1500,"open_interest":null,"t_ms":1669939200000,"volume_milli":0,"vwap_bp":1500,"yes_ask_bp":null,"yes_bid_bp":null},{"close_bp":2200,"high_bp":2200,"low_bp":1500,"n_trades":0,"open_bp":1500,"open_interest":null,"t_ms":1670025600000,"volume_milli":0,"vwap_bp":2200,"yes_ask_bp":null,"yes_bid_bp":null},{"close_bp":2200,"high_bp":2200,"low_bp":2200,"n_trades":0,"open_bp":2200,"open_interest":null,"t_ms":1670112000000,"volume_milli":0,"vwap_bp":2200,"yes_ask_bp":null,"yes_bid_bp":null},{"close_bp":2200,"high_bp":2200,"low_bp":2200,"n_trades":0,"open_bp":2200,"open_interest":null,"t_ms":1670198400000,"volume_milli":0,"vwap_bp":2200,"yes_ask_bp":null,"yes_bid_bp":null},{"close_bp":2200,"high_bp":2200,"low_bp":2200,"n_trades":0,"open_bp":2200,"open_interest":null,"t_ms":1670284800000,"volume_milli":0,"vwap_bp":2200,"yes_ask_bp":null,"yes_bid_bp":null},{"close_bp":2200,"high_bp":2200,"low_bp":2200,"n_trades":0,"open_bp":2200,"open_interest":null,"t_ms":1670371200000,"volume_milli":0,"vwap_bp":2200,"yes_ask_bp":null,"yes_bid_bp":null},{"close_bp":2200,"high_bp":2200,"low_bp":2200,"n_trades":0,"open_bp":2200,"open_interest":null,"t_ms":1670457600000,"volume_milli":0,"vwap_bp":2200,"yes_ask_bp":null,"yes_bid_bp":null},{"close_bp":3000,"high_bp":3000,"low_bp":2200,"n_trades":0,"open_bp":2200,"open_interest":null,"t_ms":1670544000000,"volume_milli":0,"vwap_bp":3000,"yes_ask_bp":null,"yes_bid_bp":null},{"close_bp":3000,"high_bp":3000,"low_bp":3000,"n_trades":0,"open_bp":3000,"open_interest":null,"t_ms":1670630400000,"volume_milli":0,"vwap_bp":3000,"yes_ask_bp":null,"yes_bid_bp":null},{"close_bp":3000,"high_bp":3000,"low_bp":3000,"n_trades":0,"open_bp":3000,"open_interest":null,"t_ms":1670716800000,"volume_milli":0,"vwap_bp":3000,"yes_ask_bp":null,"yes_bid_bp":null},{"close_bp":3000,"high_bp":3000,"low_bp":3000,"n_trades":0,"open_bp":3000,"open_interest":null,"t_ms":1670803200000,"volume_milli":0,"vwap_bp":3000,"yes_ask_bp":null,"yes_bid_bp":null},{"close_bp":4200,"high_bp":4200,"low_bp":3000,"n_trades":0,"open_bp":3000,"open_interest":null,"t_ms":1670889600000,"volume_milli":0,"vwap_bp":4200,"yes_ask_bp":null,"yes_bid_bp":null},{"close_bp":4200,"high_bp":4200,"low_bp":4200,"n_trades":0,"open_bp":4200,"open_interest":null,"t_ms":1670976000000,"volume_milli":0,"vwap_bp":4200,"yes_ask_bp":null,"yes_bid_bp":null},{"close_bp":4200,"high_bp":4200,"low_bp":4200,"n_trades":0,"open_bp":4200,"open_interest":null,"t_ms":1671062400000,"volume_milli":0,"vwap_bp":4200,"yes_ask_bp":null,"yes_bid_bp":null},{"close_bp":4200,"high_bp":4200,"low_bp":4200,"n_trades":0,"open_bp":4200,"open_interest":null,"t_ms":1671148800000,"volume_milli":0,"vwap_bp":4200,"yes_ask_bp":null,"yes_bid_bp":null},{"close_bp":4200,"high_bp":4200,"low_bp":4200,"n_trades":0,"open_bp":4200,"open_interest":null,"t_ms":1671235200000,"volume_milli":0,"vwap_bp":4200,"yes_ask_bp":null,"yes_bid_bp":null},{"close_bp":6000,"high_bp":6000,"low_bp":4200,"n_trades":0,"open_bp":4200,"open_interest":null,"t_ms":1671321600000,"volume_milli":0,"vwap_bp":6000,"yes_ask_bp":null,"yes_bid_bp":null}],"category":"sports","close_at_ms":1671407999000,"created_at_ms":1668816000000,"currency":"usd","description":"","event_key":null,"fee_schedule_id":"demo-zero","final_price_bp":6000,"first_price_bp":1800,"hardness_tags":["upset"],"id":"demo-argentina-wc-2022","interval_min":1440,"notes":"Opened a favourite, crashed after losing to Saudi Arabia, then climbed back through the knockouts.","provider":"demo","provider_id":"argentina-wc-2022","quality":{"life_days":29,"n_trades":0,"traded_bars":0,"unique_bettors":null,"volume_milli_total":0},"question":"Will Argentina win the 2022 FIFA World Cup?","resolution":1,"resolution_source":"v1 demo pack","resolved_at_ms":1671407999000,"schema_version":"market.v2","source":"reconstructed","tags":[],"trades":[],"url":"","wiki_subjects":["2022 FIFA World Cup","Argentina national football team"]}
